{
  "metadata": {
    "generatedAt": "2025-10-29T16:37:30.245679",
    "generator": "build_scheduling_input.py",
    "version": "1.0",
    "totalAssignments": 45,
    "semester1Assignments": 24,
    "semester3Assignments": 21,
    "totalTimeSlots": 39,
    "totalRooms": 5,
    "description": "Self-contained scheduling input for AI-based timetable generation"
  },
  "configuration": {
    "weekdays": [
      "Mon",
      "Tue",
      "Wed",
      "Thu",
      "Fri",
      "Sat"
    ],
    "dayStart": "09:00",
    "dayEnd": "16:30",
    "breakWindows": [
      {
        "start": "10:50",
        "end": "11:05",
        "type": "short"
      },
      {
        "start": "12:55",
        "end": "13:45",
        "type": "lunch"
      }
    ],
    "sessionTypes": {
      "theory": {
        "duration": 55,
        "requiresContiguous": false
      },
      "tutorial": {
        "duration": 110,
        "requiresContiguous": true
      },
      "practical": {
        "duration": 110,
        "requiresContiguous": true
      }
    },
    "resourceConstraints": {
      "maxConsecutiveSlotsPerFaculty": 5,
      "maxDailySlotsPerStudentGroup": 7,
      "minGapBetweenSameFaculty": 0
    }
  },
  "timeSlots": [
    {
      "day": "Mon",
      "slotId": "S1",
      "start": "09:00",
      "end": "09:55",
      "durationMinutes": 55
    },
    {
      "day": "Mon",
      "slotId": "S2",
      "start": "09:55",
      "end": "10:50",
      "durationMinutes": 55
    },
    {
      "day": "Mon",
      "slotId": "S3",
      "start": "11:05",
      "end": "12:00",
      "durationMinutes": 55
    },
    {
      "day": "Mon",
      "slotId": "S4",
      "start": "12:00",
      "end": "12:55",
      "durationMinutes": 55
    },
    {
      "day": "Mon",
      "slotId": "S5",
      "start": "13:45",
      "end": "14:40",
      "durationMinutes": 55
    },
    {
      "day": "Mon",
      "slotId": "S6",
      "start": "14:40",
      "end": "15:35",
      "durationMinutes": 55
    },
    {
      "day": "Mon",
      "slotId": "S7",
      "start": "15:35",
      "end": "16:30",
      "durationMinutes": 55
    },
    {
      "day": "Tue",
      "slotId": "S1",
      "start": "09:00",
      "end": "09:55",
      "durationMinutes": 55
    },
    {
      "day": "Tue",
      "slotId": "S2",
      "start": "09:55",
      "end": "10:50",
      "durationMinutes": 55
    },
    {
      "day": "Tue",
      "slotId": "S3",
      "start": "11:05",
      "end": "12:00",
      "durationMinutes": 55
    },
    {
      "day": "Tue",
      "slotId": "S4",
      "start": "12:00",
      "end": "12:55",
      "durationMinutes": 55
    },
    {
      "day": "Tue",
      "slotId": "S5",
      "start": "13:45",
      "end": "14:40",
      "durationMinutes": 55
    },
    {
      "day": "Tue",
      "slotId": "S6",
      "start": "14:40",
      "end": "15:35",
      "durationMinutes": 55
    },
    {
      "day": "Tue",
      "slotId": "S7",
      "start": "15:35",
      "end": "16:30",
      "durationMinutes": 55
    },
    {
      "day": "Wed",
      "slotId": "S1",
      "start": "09:00",
      "end": "09:55",
      "durationMinutes": 55
    },
    {
      "day": "Wed",
      "slotId": "S2",
      "start": "09:55",
      "end": "10:50",
      "durationMinutes": 55
    },
    {
      "day": "Wed",
      "slotId": "S3",
      "start": "11:05",
      "end": "12:00",
      "durationMinutes": 55
    },
    {
      "day": "Wed",
      "slotId": "S4",
      "start": "12:00",
      "end": "12:55",
      "durationMinutes": 55
    },
    {
      "day": "Wed",
      "slotId": "S5",
      "start": "13:45",
      "end": "14:40",
      "durationMinutes": 55
    },
    {
      "day": "Wed",
      "slotId": "S6",
      "start": "14:40",
      "end": "15:35",
      "durationMinutes": 55
    },
    {
      "day": "Wed",
      "slotId": "S7",
      "start": "15:35",
      "end": "16:30",
      "durationMinutes": 55
    },
    {
      "day": "Thu",
      "slotId": "S1",
      "start": "09:00",
      "end": "09:55",
      "durationMinutes": 55
    },
    {
      "day": "Thu",
      "slotId": "S2",
      "start": "09:55",
      "end": "10:50",
      "durationMinutes": 55
    },
    {
      "day": "Thu",
      "slotId": "S3",
      "start": "11:05",
      "end": "12:00",
      "durationMinutes": 55
    },
    {
      "day": "Thu",
      "slotId": "S4",
      "start": "12:00",
      "end": "12:55",
      "durationMinutes": 55
    },
    {
      "day": "Thu",
      "slotId": "S5",
      "start": "13:45",
      "end": "14:40",
      "durationMinutes": 55
    },
    {
      "day": "Thu",
      "slotId": "S6",
      "start": "14:40",
      "end": "15:35",
      "durationMinutes": 55
    },
    {
      "day": "Thu",
      "slotId": "S7",
      "start": "15:35",
      "end": "16:30",
      "durationMinutes": 55
    },
    {
      "day": "Fri",
      "slotId": "S1",
      "start": "09:00",
      "end": "09:55",
      "durationMinutes": 55
    },
    {
      "day": "Fri",
      "slotId": "S2",
      "start": "09:55",
      "end": "10:50",
      "durationMinutes": 55
    },
    {
      "day": "Fri",
      "slotId": "S3",
      "start": "11:05",
      "end": "12:00",
      "durationMinutes": 55
    },
    {
      "day": "Fri",
      "slotId": "S4",
      "start": "12:00",
      "end": "12:55",
      "durationMinutes": 55
    },
    {
      "day": "Fri",
      "slotId": "S5",
      "start": "13:45",
      "end": "14:40",
      "durationMinutes": 55
    },
    {
      "day": "Fri",
      "slotId": "S6",
      "start": "14:40",
      "end": "15:35",
      "durationMinutes": 55
    },
    {
      "day": "Fri",
      "slotId": "S7",
      "start": "15:35",
      "end": "16:30",
      "durationMinutes": 55
    },
    {
      "day": "Sat",
      "slotId": "S1",
      "start": "09:00",
      "end": "09:55",
      "durationMinutes": 55
    },
    {
      "day": "Sat",
      "slotId": "S2",
      "start": "09:55",
      "end": "10:50",
      "durationMinutes": 55
    },
    {
      "day": "Sat",
      "slotId": "S3",
      "start": "11:05",
      "end": "12:00",
      "durationMinutes": 55
    },
    {
      "day": "Sat",
      "slotId": "S4",
      "start": "12:00",
      "end": "12:55",
      "durationMinutes": 55
    }
  ],
  "slotCombinations": [
    {
      "type": "single",
      "slots": [
        "S1"
      ],
      "durationMinutes": 55
    },
    {
      "type": "single",
      "slots": [
        "S2"
      ],
      "durationMinutes": 55
    },
    {
      "type": "single",
      "slots": [
        "S3"
      ],
      "durationMinutes": 55
    },
    {
      "type": "single",
      "slots": [
        "S4"
      ],
      "durationMinutes": 55
    },
    {
      "type": "single",
      "slots": [
        "S5"
      ],
      "durationMinutes": 55
    },
    {
      "type": "single",
      "slots": [
        "S6"
      ],
      "durationMinutes": 55
    },
    {
      "type": "single",
      "slots": [
        "S7"
      ],
      "durationMinutes": 55
    },
    {
      "type": "double",
      "slots": [
        "S1",
        "S2"
      ],
      "durationMinutes": 110,
      "requiresContiguous": true
    },
    {
      "type": "double",
      "slots": [
        "S3",
        "S4"
      ],
      "durationMinutes": 110,
      "requiresContiguous": true
    },
    {
      "type": "double",
      "slots": [
        "S5",
        "S6"
      ],
      "durationMinutes": 110,
      "requiresContiguous": true
    },
    {
      "type": "double",
      "slots": [
        "S6",
        "S7"
      ],
      "durationMinutes": 110,
      "requiresContiguous": true
    }
  ],
  "rooms": [
    {
      "roomId": "AB-402",
      "type": "lecture",
      "capacity": 60
    },
    {
      "roomId": "AB-411",
      "type": "lecture",
      "capacity": 60
    },
    {
      "roomId": "AB-412",
      "type": "lecture",
      "capacity": 60
    },
    {
      "roomId": "LAB-1",
      "type": "lab",
      "capacity": 60
    },
    {
      "roomId": "LAB-2",
      "type": "lab",
      "capacity": 60
    }
  ],
  "studentGroups": [
    {
      "semester": 1,
      "section": "A",
      "studentCount": 60,
      "studentGroupId": "MCA_SEM1_A",
      "compulsorySubjects": [
        "25MCA11",
        "25MCA12",
        "25MCA13",
        "25MCA14",
        "25MCA15",
        "25MCA16",
        "25MCA17"
      ]
    },
    {
      "semester": 1,
      "section": "B",
      "studentCount": 60,
      "studentGroupId": "MCA_SEM1_B",
      "compulsorySubjects": [
        "25MCA11",
        "25MCA12",
        "25MCA13",
        "25MCA14",
        "25MCA15",
        "25MCA16",
        "25MCA17"
      ]
    },
    {
      "semester": 3,
      "section": "A",
      "studentCount": 60,
      "studentGroupId": "MCA_SEM3_A",
      "compulsorySubjects": [
        "24MCA31",
        "24MCA32",
        "24MCAP1"
      ]
    },
    {
      "semester": 3,
      "section": "B",
      "studentCount": 60,
      "studentGroupId": "MCA_SEM3_B",
      "compulsorySubjects": [
        "24MCA31",
        "24MCA32",
        "24MCAP1"
      ]
    }
  ],
  "constraints": {
    "studentGroupOverlap": {
      "cannotOverlapWith": {
        "MCA_SEM1_A": [
          "MCA_SEM1_A"
        ],
        "MCA_SEM1_B": [
          "MCA_SEM1_B"
        ],
        "MCA_SEM3_A": [
          "ELEC_AD_A1",
          "ELEC_SS_G1",
          "MCA_SEM3_A"
        ],
        "MCA_SEM3_B": [
          "ELEC_AD_B1",
          "ELEC_SS_G1",
          "MCA_SEM3_B"
        ],
        "ELEC_AD_A1": [
          "ELEC_AD_A1",
          "MCA_SEM3_A"
        ],
        "ELEC_AD_B1": [
          "ELEC_AD_B1",
          "MCA_SEM3_B"
        ],
        "ELEC_SS_G1": [
          "ELEC_SS_G1",
          "MCA_SEM3_A",
          "MCA_SEM3_B"
        ]
      },
      "canRunParallelWith": {
        "MCA_SEM1_A": [
          "MCA_SEM1_B"
        ],
        "MCA_SEM1_B": [
          "MCA_SEM1_A"
        ],
        "MCA_SEM3_A": [
          "MCA_SEM3_B"
        ],
        "MCA_SEM3_B": [